app_url,app_name,scenario_text,infotypes
https://play.google.com/store/apps/details?id=com.facebook.orca,Facebook Messenger,I use this screen to do many things.  One of the things that I do here is choose if I want to display as active or not.  For the most part I do not like showing as active. The reason for this is I do not like people knowing whether or not I am on the app and actively using it.  Sometimes if this is the case then people I know will message me to start a conversation and I do not have time to do that but don't want to be rude.  So sometimes I find myself in a hard spot with that. I can also use this page to set the app to sync with my contacts in my phone.  This way I can connect with people on messenger who are contacts in my phone. I can also control the notifications I get.  ,"81:118,239:246,355:367,554:559,590:596,600:609,618:626,663:676"
https://play.google.com/store/apps/details?id=com.turner.tnt.android.networkapp,Watch TNT,"This is the sign in page for the TNT app. It allows you to log in with your TV provider to watch the TNT channel on your mobile phone. To do this, you would click on the sign in button on the top left and then choose from a list of cable providers. If you have xfinity, for example, you would pick that and it would automatically log you in. There are various options that you can configure to address privacy settings, with regards to data usage. If you do not want to share data with third parties, you would toggle that off. Keep in mind that this is enabled by default, as most people do not navigate down to disable it. On this page, there is also the option to use mobile phone data (as opposed to wifi data). If has a mobile data cap, then this option must be toggled off.","76:87,436:446,671:688"
https://play.google.com/store/apps/details?id=com.fidelity.android,Fidelity Investments,"I use this screen to access and trade my dumb a** investments. From here I get a list from which I can keep an eye on each position, as well as an easy link to be able to sell them or buy more. By clicking on the green button indicating their value, I can also bring up more information regarding the position, and choose to display one of those instead. The default is the last price. But other options include the day's change, the current value, the gain or loss in total or for today. By using the tabs at the top, I can access stock watch lists I have created, as well as live market information including futures. The screen uses my investments and the money I have available on my account. I am especially uncomfortable showing my positions because I know institutions keep an eye on what people invest in in order to tank them.","81:85,243:248,301:309,379:384,453:487,532:549,582:600,611:618,639:650,659:664,738:747"
https://play.google.com/store/apps/details?id=com.google.android.apps.paidtasks,Google Opinion Rewards,"After making a shopping trip to a location, you are then given the choice to verify you went to the location, and upload a receipt of some kind if you choose. You can choose from telling the app that it is mistaken and you did not visit the location; you visited but did not purchase anything; you made a purchase but do not have a receipt; you only have a digital copy of the receipt; skip the task altogether; or upload a copy of the receipt by taking a photo of it. After you take a photo, the app will upload a copy of it, and verify the information listed on the receipt. It will then save the date you went to the location and the total you spent at the location, and will reward you by giving you a payment in the form of a Google Play Balance, which can later be spent on digital purchases.","305:313,424:428,456:461,568:575,599:603,660:668,706:713,780:797"
https://play.google.com/store/apps/details?id=com.lensa.app,Lensa,"I can click on the add photos button to add a bunch of my pics, or the pics of someone dear and near to me. It usually asks 10 pics, but one could add upto 20 pics. Then, we can select the genre of what we would like to see ourselves to be, from the point of view of the AI. There are multiple genres to choose from, like fantasy, ancient, sci fi, so on and so forth. Once we select the genres that we want, there is a 5 genre limit in the app, we click on the done button, which would lead to the screen that would say to wait for a while for the AI to finish the processing. Once the process is complete, we would be shown a bunch of pics, 50 to be precise, from those genres we selected, imagining us to be in that scenario.","23:29,127:131,189:194,294:300,421:432,548:550,718:726"
https://apps.apple.com/us/app/chase-mobile-bank-invest/id298867247,Chase Mobile,This page is basically my spending and usage of my money in the bank. It shows how much I have spend and how much I have earned through various jobs I have done. I can set a goal of certain usage limit of my money by clicking on SET A NEW GOAL button on the top. Then I can enter a number that I want to keep my spending under. The app will remind me everytime I will go over the limit and usage of the money. The interactions described before is how I would track my usage of my money and my spending and earning information. The information that the app collect is a part of this screen. And they may share these information of my bank usage to third party which I do not want them to do in any circumstances. They combine my profile information combined with my usage data also my contacts and could share to third parties. ,"51:56,64:68,79:100,105:160,190:201,282:288,414:426,468:473,493:501,633:643,728:747,765:775,784:792"
https://apps.apple.com/us/app/apple-health/id1242545199,Apple Health,"This is the screen on my apple health app that allows me to see my average walking and running distance each day.  I can look at the previous day, week, month, or even year and see what trends I have had.  The goals that I want to achieve through this screen are to better track how much I ran that day.  I can look at the trend of my walking distance or my running distance and see if i am meeting my goals.  My interactions with this screen to achieve my goals is I use it to monitor my progress and see if i am walking enough or running enough throughout the day.  The information that is used by this app to support this screen includes information such as my workouts that are logged, the numnber of steps walked, my biometric data such as heart rate and steps walks.","67:94,95:103,181:203,279:302,335:351,358:374,489:497,506:565,664:672,722:736,745:755,760:771"
https://play.google.com/store/apps/details?id=com.google.android.youtube,YouTube,"I open the app for the purpose of the entertainment. The educational information available on Youtube is mind blowing. usually I watch youtube because I like the content and games that certain youtubers put out, sometimes when I just have nothing to do and I just need a way to pass the time, I just hop straight on to youtube and find it easy to use a couple of hours just watching some usesfull videos. If I go to youtube and search about any topic, I will get videos that allow me to choose what happens. If i search music, I will get tons of music. like if i search anything that isn't just pounding the keyboard i will get a multitude of videos. Whenever I have had a bad day or just feel down, I just hop straight on to youtube a watch some funny videos to laugh and make my day better.","162:169,174:179,445:450,520:525,643:649"
https://play.google.com/store/apps/details?id=com.chickfila.cfaflagship,Chick-fil-A,"This screen shows me how many points I have available to use, the items that I can redeem with those points, and how many points are required for each item. I like to redeem some rewards on each visit so that I can keep my costs down. It makes me happy to know that I have saved some money! I usually just look at how many points I have and then scroll through the screen to see if I have enough points for any of the items that I am planning on purchasing that day. I try to figure out which item is a better deal or will save me the most money with the least amount of points. To support this screen, the app knows my user information, my past purchase history, and my points redemption history. Also, my current points information is needed to show me what items I can redeem or not.","21:60,101:107,113:155,179:186,223:228,284:289,314:336,418:423,493:497,510:514,620:636,641:662,671:696,715:733,755:785"
https://play.google.com/store/apps/details?id=com.sportclips.ultimatemvp,Sport Clips Haircuts Check In,"This is for the shop where I often get my hair cut. They don't take reservations in the traditional sense. When I'm ready for a haircut, I open the app and select the store that I want to go to. That takes me to this screen where I can see how long the current wait time is, a list of the stylists that are working, and if it's just for me or if I'm bringing in additional people. If I want a specific stylist then I can see next to their name how long the wait is just for them. Then I can decide if I really want to wait for them or just take the next available, etc. Once I do all that, I hit the ""check in"" button at the bottom. Once I do that it is similar to making a reservation, but the app tracks my location so it knows when I am near the store. If I'm close then the stylist I selected (or whichever one is available if I selected that) will wait for me to arrive.","16:20,42:50,128:135,167:172,240:273,289:297,303:314,320:339,347:379,439:443,444:478,518:522,674:685,709:717,778:785"
https://play.google.com/store/apps/details?id=homeworkout.homeworkouts.noequipment,Home Workout,"I used this screen to monitor my daily calorie burn routine, also my fitness routine. It shows the progress of my change, We can check what type of exercises I done, The frequency and duration of my workouts can be monitored. I can also see the body fat percentage. Here we can also see the date wise report which is more helpful to check weather we made a progress consistency . and we can able to enter our weight manually so can we can also check our weight loss. The information this screen needed is my weight and exercise done today will be saved. which can be used to calculate my calorie. The exercise will be provided based on my calorie count setting. If I need to burn calories. i Can set exercise preference according to It. If I need to work out more this app can add extra workout according to my prefrence.","409:415,291:300,601:609,357:377,454:465,95:120,135:164,39:59,588:595,301:307,69:84,639:660,199:207,787:794,700:719"
https://play.google.com/store/apps/details?id=com.reddit.frontpage,Reddit,"This ""browse communities"" feature pulls a frequently visited community from my history and shows me newest and hottest topics. It uses my personal information - my history - to filter information and topics that would ideally appeal to me. It prevents me from having to scroll through an extensive feed.

All I have to do with this is visit the sidebar, select ""browse communities"", and it gives me the highlights. It's a series of very simplistic interactions that streamline my entire process of drilling down to discussions and debates that appeal to me. Lately it's been heavy on the Final Fantasy 14 front due to re-subscribing to that game and following the latest hardcore raiding events. 

The only information required by the app seems to be browsing history. Nothing else is really required. I am okay with providing this information since it benefits me directly and, even if I get the occasional ad, it is so non-invasive that the pros vastly outweigh the pros.","61:70,119:125,138:158,164:171,298:302,364:382,517:528,533:540,590:606,755:763,912:914"
https://play.google.com/store/apps/details?id=com.reddit.frontpage,Reddit,"This specific screen allows me to review all of my past activities on the Reddit platform. Through this screen, I can also view all of my Karma points, how long I have had an account on the Reddit platform as well as all of the past posts and comments I have written. Under my About tab, I can also see what Reddit Trophies I have accumulated and won over the years. I can also see how much of my Karma points come from the posts I have made and how much of it comes from comments I have made on the posts of other users. I can also see who my followers are and how many Karma points each of them have individually. Finally, from this screen I can edit any of my many profile details as well as my avatar and all of the different bling he has earned or I have bought for him over the years.","56:66,138:150,197:205,224:232,252:266,303:342,424:429,472:480,488:514,515:520,537:557,562:614,668:683,698:704,730:735"
https://play.google.com/store/apps/details?id=com.ubercab.eats,Uber Eats,"The main goal of this screen, among others, is to access the benefits of the app that I have earned with my previous purchases on the app itself. Whenever my goal is to use a voucher that I have earned or to use my Uber Cash, I come directly to this portion of the app. I then select whether I want to use my Uber Cash or use a voucher, or I can even do both. It also logs my credit card information, as it may be needed to complete a transaction, should I not have enough to cover it with the vouchers and with the Uber Cash. My interaction consist mainly of selecting which methods I want to use, or to override a default setting from before. The app then combines my credit card info from this screen with my other identifying information down the line in order to complete my order.","117:126,328:335,376:399,435:446,494:502,516:525,576:583,624:631,670:686,718:741,780:785"
https://play.google.com/store/apps/details?id=tv.twitch.android.app,Twitch,"I can talk to the streamer and the other people watching the stream with this chat. I can use emotes that Twitch provide you, or I can use emotes specific to the streamer if I decide to subscribe to the streamer. On desktop, I can download an extension that provides even more emotes that I can use. Chatters cannot see those emotes unless they also have the extension installed. If I ever get banned from the chat, my phone number will be permanently banned, and I'd have to create a new account in order to chat again. Twitch tracks how often people are active in each streamer's chats. They use such data to determine which ads to show non-subscribers. If you subscribe to a streamer, you also don't have to deal with video ads that play over the stream. The ads sometimes have links that you can click on which redirects you to another site.","61:67,94:100,162:170,243:252,410:414,419:431,489:496,535:587,603:607,621:654,721:730,762:765,840:844"
https://play.google.com/store/apps/details?id=com.ubercab.eats,Uber Eats,"I use this screen to quickly find restaurants that I have ordered from before and that I like. I can easily scroll thru the list to see the name of the restaurant, the time it would take to get delivered to me, the ratings it has on the app from other users, whether it participates in uber one which would mean no delivery fees, and the address of the restaurant. I can achieve finding a place that I want to eat at quickly, and that I have previous experience with. I can see any of the ratings I have personally given the restaurant. I can click on the individual listing to see more information about the restaurant and to go to the restaurants order page in order to place a new order. I can also use the listing to find previous orders I have made and to find favorite meals I have ordered.","34:45,46:70,140:144,215:222,252:257,315:328,338:345,389:394,525:535,567:574,637:654,684:689,735:741,766:795"
https://play.google.com/store/apps/details?id=com.tayu.tau.pedometer,Pedometer,"What this screen provides is more than just verifiable data. While the settings allows the control of how the steps are tracked, this screen is the live and active usage tracker. It allows me to see the steps taken throughout the day on a graph that creates a visualization which is easy to analyze. This let's me know if I am on track towards my goals and where I am at so far. Ultimately I am trying to make sure I am walking enough every hour and this screen is the main indicative for that. Also it shows me my trends or habits because of the graphs, this allows me to make adjustments to reach my goals. The gps location or hardware sensors are what is going to provide the step reading functionality but one method uses more battery than the other. The limitation becomes how the application is running in the background. Overall I think the settings in this screen as well as visual indicators provide all the functionality I need to stay on track, manage my steps, and utilize the information towards any goals.","71:79,102:127,164:169,203:208,239:244,319:352,617:625,679:691,782:808"
https://apps.apple.com/us/app/govee-home/id1395696823,Govee Home,This is where i go to when i want to shutdown or put on my devices. Most of them are set on automatic but sometimes i want to turn them off and on manually depending ifi  am at home or leaving the house. Its well laid out and is grouped in a way that i don't have to go through a bunch of screens to get to the right device i want to control. The screen is very intuitive and lets me choose between devices very easily and fluid. Sometimes but rarely do i need to switch from this screen and if i do its mostly to like change the color or something that my lamps and bulbs would fit with the ambience i want to experience. Sometimes on this screen i disable items that i don't think i would be using for a very long time  on end.  ,"59:66,317:323,530:535,658:663"
https://play.google.com/store/apps/details?id=com.cfdrink,"Mixel, Cocktail Recipes","This screen helps you to organize all of the ingredients you have in your liquor cabinet, pantry, and fridge in order to maximize the amount of recipes you can make for cocktails and other drinks. In particular, this is sorting by most recently added ingredients, but they can also be displayed and sorted in other ways, as well, you can add other ingredients to your list through here. You can also remove ingredients one at a time (or all together with a single button press) once they are used or no longer available, and can search for different ingredients you own, or would like to add. You can also navigate from this page to the page that shows a virtual display of your cabinet, or to the page that lists recipes you can make with your ingredients (or can almost make if you gain one or two more for that particular drink). ","74:88,144:151,165:178,189:195,550:561,679:686"
https://apps.apple.com/sa/app/efhub-23-peshub/id1591724001,EFHUB23,"So basically what you see here are players of the week for the second week of February 2023. These are players I am currently aiming to obtain. By searching these players up, the app sees I am interested in these types of players and would probably promote them more on my homepage in the future. This is how they grab their usage data from me. They look up what I look for, and the packs that I search for and keep that information for future updates of the app. To better implement features they rely on me being able to use the app my way and search up players I am interested in. For example, if I am only looking for current POTW players like in this screenshot, the app would cater to that in the future and only promote POTW players to me in the home page screen from now on.","103:110,325:335,358:373"
https://apps.apple.com/us/app/capital-one-mobile/id407558537,Capital One Mobile,"I use this screen to manage and view the contact information and bank account linked to this specific Zelle profile. To get to this screen, I open the app and chose ""Profile"" and then ""Zelle"". Here I can unlink my email address, link a new one, and link, unlink and register my phone number. It's useful not only to edit this information but also to view it in order to ensure that I'm using or supplying someone else with the correct information in order to receive a payment. Sometimes I've had to do this when sending payments to myself from another bank account, as I have had several bank accounts that at times have shared or used similar contact information. I don't think both a email and phone number are required to use Zelle but I assume that it can be helpful. If you click the ""i"" icon in the top right corner of the container labeled ""Additional contact info"" you will see a brief description of this feature. ","41:60,102:115,214:227,469:476,521:529,553:565,589:602,687:692,697:709,860:872"
https://play.google.com/store/apps/details?id=com.amazon.mShop.android.shopping,Amazon Shopping,"When I check this screen I often am using it to confirm that my order has shipped or arrived or to try and get a refund/return if there is a problem with the product. I interact with the screen by clicking on the little person avatar at the bottom of the screen to arrive on this page and then I use my finger to swipe up if I need to scroll further down to find my product. I think tap on the product I want to interact with and the page loads information about only that product. On the new page I can see when the item was delivered or when it will be delivered/track package, get help with the product, view details of the purchase (payment information), and write a review. The information the app uses is my login information, my purchase history and my payment information. The app would be useless without following that personal information and I would fully expect it to have that access. ","64:69,366:373,508:535,539:578,627:635,671:677,714:731,736:752,760:779,829:849"
https://play.google.com/store/apps/details?id=org.ridemetro.qticketing,Q Ticketing,"I use this screen to keep payment methods available for me to buy tickets in the app. My goal with this is to travel around town for an affordable price in a sustainable way. By using this app and keeping my cards in it, I can pay on the fly as needed. Being able to pay through just the app, I don't have to worry about carrying cash or loading up a card. I also don't have to worry about handling dirty money, nor about tapping a card onto the scanner thingy. I just pay directly from my cards using the app, then I can show my ticket to the bus driver with the app, and I get to go on the bus or the light rail. If you notice, it also has google pay available, which provides the fastest and most convenient method of payment, and goes directly to my bank account.","26:41,66:73,147:152,208:213,330:334,405:410,432:436,544:547,642:652,754:766"
https://play.google.com/store/apps/details?id=com.instagram.android,Instagram,I can easily switch accounts using this screen if I use multiple Instagram accounts. I can change or view my profile picture using this screen. I can also edit my profile and bio utilizing the edit profile option on this screen. I can share my profile link with anyone on Instagram. I can follow new people using this screen. I can see how many posts I posted before and how many followers I have and also I can see how many followed me. I can see my previous posts and videos using this screen. I can also remove the old posts. I can create a new post or new reel using this screen. I can add a story to my timeline. I can easily navigate to the homepage or search for anyone by using names and hashtags or I can watch new reels posted by my friends and unknown people by using the bottommost icons.,"175:178,371:396,470:476,460:465,560:564,163:170,109:124,416:436,743:750,596:601,20:28,244:256,763:769,696:704,608:616"
https://apps.apple.com/us/app/pok%C3%A9mon-go/id1094591345,Pokmon GO,"To log my health benefits for the current day, I open the app and choose my profile page. Next, I tap on the ME tab under my profile page. The app can collect the movement and data from the health app of my phone. The app also uses my location to track distance. I can also keep track of how many steps and calories burned in a week. Also, the app shows my most recent walks, runs, and rides under the WEEKLY PROGRESS section. This page also keeps track of different in game rewards for hitting distance goals for 5km, 25km, and 50km each week. I can see  different landmarks, counties, cities, and towns visited with badges under the Medals section. I can view present level and advancement to the next level. I can tap to find out if any chores are needed to advance levels. I'm able to view every Pokémon I've ever designated as my buddy, tap. This page shows recent activities, including Pokémon I've captured and victories in battles. I can modify the appearance and attire of my avatar. Overall Activity for the course of my account's existence.","10:25,125:132,163:171,176:180,235:243,253:261,288:332,369:374,566:575,577:585,587:593,599:604,1001:1009"
https://play.google.com/store/apps/details?id=com.dollargeneral.android,Dollar General,"This screen is used to find stores around you by utilizing your phones location tracker. The store uses this to find a store near you so that you can achieve optimal shopping experiences. I shop a lot at Dollar General so this really helps me find a store nearby and always be able to achieve what I want to. The app only uses your phones location to find this information.

It also helps as it can search for local ads which improves your shopping experience greatly. I interact with this screen weekly to find local stores to go to. It lets you personalize your shopping experience greatly to where you don't struggle with something that can be tricky. It also means you dont have to share your information with any other app. Like google or otherwise. The screen also allows you to input a zip code instead of having to allow location.","28:34,71:87,250:255,332:338,339:347,418:421,795:803"
