app_url,app_name,scenario_text,infotypes
https://apps.apple.com/ca/app/paypal/id283646709,Paypal,"When I used this screen I can look at what is in my wallet that I currently have with this app. I can also see what type of finances that are connected with PayPal. In this case, my Wells Fargo's account is connected to it. 
My goal when I use this page is to get all my banks and financial things in order. This page keeps track of bank accounts and credit cards. It's an easy way to see what is linked with my PayPal and way for me to transfer money between the different types of accounts. It also has different promotions on it and gives me the ability to accept direct deposits from other businesses.
The information that the app uses is my financial information as well as my personal information. They need to confirm that the bank that I use is correct, and that my name fits the bank account.","38:58,111:163,182:193,272:277,334:347,352:364,413:419,516:526,568:583,684:704,736:740,790:802"
https://play.google.com/store/apps/details?id=com.relayrides.android.relayrides,Turo,"I use this screen to change my contact preference.  From here I adjust my setting for email, phone contact, payment, and other things like this.  I can put in credit card information so that I can pay people for cars that rent.  I use this screen to get to messages where I can contact the people who I am renting from.  I can then communicate with the person and send payments automatically.  This screen allows me to receive messages and continue to build my own profile.  This page is easy to navigate and easy to update.  When I don't use the app after a certain amount of time I am signed out and stop getting the notifications.  I can also control notification from here and that is good because I don't like getting a lot of notifications.  I like to be able to turn things off.  ","732:745,654:666,217:226,306:313,31:49,369:377,212:216,159:182,108:115,201:207,93:106,353:359,465:472,427:435,86:91"
https://apps.apple.com/us/app/pocket-casts/id414834813,Pocket Casts,"This is the first screen i see when i open up the app, this is perfect for me because i can see exactly what is new and what is old. If i see a red dot on the podcast i know right away there is new content available . I set it to download the content as it is released so i don't have to do it manually. I just love opening up my app and have everything ready for me. I pick something i want to listen to and listen to a few minutes of it , If i find that the show will not be any good today i move on to the next podcast and so on. Love the layout of the app because it makes it so easy to read and easy to navigate and find exactly what i am looking for and don't have to scroll around too much","104:115,120:131,243:250,460:464,514:521,634:655"
https://apps.apple.com/us/app/fitness/id1208224953,Apple Fitness,I use this app specifically the one on the screen to see how much distance I covered walking each day. I want to keep track of my health by doing the required exercises in order for me to have a better and healthy lifestyle. It is a very valuable information for me. It is so helpful.    This app helps me to have the option to increase or decrease my daily walking activities. I get motivated when I see the chart goes up and when the numbers go up. I get notifications on my phone whenever I need to increase my walking distance and it also notifies me when I have met my required distance for the day. It is also fun and entertaining whenever I get notifications of getting achievement badges. I believe the app gets the information by syncing via my apple watch and thus it gets data and shows a chart on my app screen.,"57:101,130:136,159:168,358:376,457:470,514:530,574:591,677:695,800:805"
https://apps.apple.com/us/app/fitbit-health-fitness/id462638897,Fitbit,"First thing i do in the morning is open the app and see how much sleep i have gotten that night, that usually dictates my day knowing how tired i am. I then at the gym track my heart rate, i want to get it up to at least 100+ that way i know how hard i am working out and if i need to workout harder. I think also do some cardio which i try to do at least 3K steps  a day and sometimes pass that. If i don't reach that in the morning i use the app again in the afternoon to gain more steps and keep track of heart rate while i'm getting my steps in. Late at night i then open the app before i go to sleep to check how my day was and if i achieved most of my goals which i usually do","56:95,134:148,242:267,275:276,285:299,322:328,484:489,508:518,614:628,633:663"
https://play.google.com/store/apps/details?id=come.playrix.homescapes,Homescapes,"Homescapes is a match three game that allows you to track your progress through the game. If you want to be able to import your progress onto a new device, you would have needed to accept their agreement and connected an account to it, so it has a place to back up. The game gives you the option of using your Google Account or your Facebook, or both (I am not sure). In the upper right hand corner, I would select the Cog Wheel settings, then click the Save Progress Button. This screen pops up and allows me to connect or disconnect either my Google Account or my Facebook Account. You have the ability to swap back and forth between the two. Once that is done, you can then changes your user pic by clicking the Edit Profile button. You are able to select one of the supplied images or select the one from your Facebook Account, after logging in.","63:71,148:154,194:203,221:228,270:274,333:341,545:559,566:582,690:698"
https://play.google.com/store/apps/details?id=com.google.android.apps.photos,Google Photos,"I use this screen when I want to share photos with other people, especially a large number of photos. I use it to share photos I've taken, as well as share photos with a family member who wants prints, but doesn't yet know which photos they want prints of. To achieve this, I click on 'Sharing' in Google Photos to get to this screen, and then I'd select 'Create shared album'. If I have one already created that I want to share again or with another person, I'll click on the particular album, and then click on the plus sign under that album's name, which enables me to add people to share it with. When I use this screen, I have to enable it to have access to my camera and contacts in order to share anything. A person I shared photos with, or I myself, sometimes also will edit albums. For example, when I need to make prints for a family member, I or they will click 'like' on the particular image to indicate that's what they want printed. It's a lot easier than other ways.","39:45,177:183,241:255,305:311,370:375,546:550,576:582,666:672,677:685,783:789,824:830,898:903"
https://apps.apple.com/us/app/myfitnesspal-calorie-counter/id341232718,MyFitnessPal - Calorie Counter,"So this screen shows my starting weight on the date that I first started using the app. When looking at this screen I can see how my weight has changed and even update my goals such as the goal weight and how much weight to lose each week. I do also use this screen to access my nutrient goals, which I customize to my current recommended diet plan (such as fiber, sodium, calorie customization, and sugar grams). With this screen you can also access your macronutritent percentage goals if you have a change you need to make other than the recommended guidelines. I do not like that you cannot change your goal weight to under a specific BMI. I can see how long it's taken me to lose weight by calculating the time between the current date and the starting weight date and that makes me either feel accomplished or depressed depending on the day.","24:39,47:51,171:176,189:200,205:238,279:293,339:348,358:363,365:371,373:394,400:411,456:487,553:563,685:691,758:769"
https://apps.apple.com/us/app/fetch-have-fun-save-money/id1182474649,Fetch,"This screen helps me keep track of my progress toward earning gift cards. When I interact with this screen, I am looking for how many points have I accumulated so far. I am also able to upload additional receipts in order to earn more points. I can also quickly view how many more points I need to accumulate before I can earn a gift card of my choosing. This app uses the information above in order to contact me with updates and other offers. It helps me keep track of my progress toward my goal.  From this screen I am also able to look up additional offers that might be available to me to maximize my savings with purchases online.  From this screen I am also able to interact daily with this app in order to win bonus points. No purchase is necessary to play the bonus points game, you must simply log on and spin the wheel.","62:72,125:166,204:212,235:241,267:308,329:338,419:426,474:482,554:560,619:628,735:743,769:781"
https://play.google.com/store/apps/details?id=com.ubercab,Uber,"Uber is a ride share service app. On this screen I can control the way I use the Uber App and the way it uses my info. If I want to add a permanent address that is my home, or work I can click on those options listed. If I have any other address I want to save that I go to often I can click on the Shortcuts option. Those are great for time saving so I don't have to type in or re-type in addresses that I use often. I can also control what kind of data I want to share with Uber by clicking on the Privacy option and control the log in process for my security by clicking on the Security option. This keeps anyone else from accessing my account that isn't me. I can also come here if I want to change how many notifications I'm getting or how I'm alerted for things like arrivals of cars to pick me up or messages from my driver. I would come here to set things up when I'm starting out on the app or to adjust things as my wants and needs change.","167:171,238:245,390:399,450:454,553:561,639:646,703:737,773:803,807:815,821:830"
https://play.google.com/store/apps/details?id=com.piriform.ccleaner,CCleaner - Phone Cleaner,"It shows the amount of storage the app has cleared. The app clears storage by deleting unwanted media in my phone, repeating pics, cache memory and scans for large images that i can choose to delete if i wish so. The app clears those storage spaces, freeing up the phone, which makes the overall functioning and the performance of the phone relatively better and smooth in comparision to what it had been before the clean up. The app also clears the RAM memory. In all phones, including mine, there would be a ton of background apps running perpetually, which one do not need to have at any given time. The app scans the background to see which all apps are running in the background, singles out those that are not necessary, and gives me the option to shut down those apps, thereby releasing the memory that was hogged down by those apps.","13:30,67:74,96:101,125:129,131:143,164:170,234:248,265:270,450:460,469:475,528:532,639:683"
https://play.google.com/store/apps/details?id=com.mcdonalds.app,McDonald's,My guilty pleasure is using the McDonalds app. I use it about once a week. I get points every time I do use it and they add up for free food. Also using the app you get special discounts every time you order from McDonalds. Its fun and a nice way to break my 6 days a week Keto Diet. I usually select this on Friday because french fries are free. I will then add one of their burgers and a drink and I enjoy myself. About one every four trips I have enough points so at least one item I am ordering is free. Which is nice. I always tell people who go to McDonald's to get the app because they will save money. I check it daily sometimes they have a really good promotion for that day and I will change up which day is my McDonalds Day. I am getting hungry now!,"136:140,177:186,213:222,273:282,331:336,376:383,390:395,457:463,603:608,661:670,721:734"
https://play.google.com/store/apps/details?id=com.instacart.client,Instacart,"Whenever I want to cash in on the rewards that I have earned or the promo offers that the app is offering, I come right to this section of the app. It will show me all of the benefits that I am able to use at this moment, and I can select which ones to apply, and it will also tell me when, and if, they expire, so that I know by when to use them, if applicable for that specific promotional offer. The interaction with the screen comes by way of selecting the promo that I want to use on the order that I am about to place, selecting my payment info on that page in case the promo does not pay off the entirety of the charges, and proceeding with my order. The app will then use my payment info, and on later screens, my full name and my address, in order to complete the full delivery of the order that I have placed to me.","34:41,74:80,175:183,380:397,461:466,619:626,651:656,683:695,722:731,739:746"
https://apps.apple.com/us/app/strava-run-ride-hike/id426826309,Strava,"These recap screens are important for me to assess how my run went and to compare them to other similar efforts. With this run I can see that I performed worse than I usually do - and as you'll note from the silly commentary, I know that's because I was sick recently and still feel the effects. 

This page is the most important page for me as a strava user. As soon as I get home from a run, I upload my data and look at the info on this page to assess my effort and see how it compares to other runs I have gone on. This lets me improve my training and also is just kind of fun.

This screen is supported by the collection of GPS data, the collection of heart-rate data and estimations of calories burned by use of my height/weight info I have provided to the app. ","6:11,51:66,408:412,460:466,500:504,545:553,633:641,661:676,725:731,732:743"
https://play.google.com/store/apps/details?id=com.bestbuy.android,Best Buy,"This is the product screen on Best Buy's app. From here, I can examine the product that I am interested in. I can pick what particular attributes I want from a product if there are multiple to choose from; screen size, resolution, storage space, etc. I can browse reviews from people who have purchased this particular product, and I can browse through photos that people have taken of their product. I can browse specific features from the product, as there is a convenient list that I can expand, and I can browse the specific specs for the model that I am looking at. I can watch official videos from the product so I can learn more about it, and obviously, I can add the product to my cart so I can purchase it; I can also select shipping or pickup from this screen. Finally, I can purchase a store warranty from this screen, if I choose to do so.","75:82,119:167,206:217,219:229,231:244,264:271,353:359,423:431,475:479,529:534,543:548,592:598,689:693,797:811"
https://apps.apple.com/us/app/myfitnesspal-calorie-counter/id341232718,MyFitnessPal - Calorie Counter,I use this screen to remind myself of my starting point when I made my most recent weight loss goal. I consider both my long term goal of my goal weight as well as my weekly goal of losing one pound a week. I update the information on this screen as it changes to reflect my progress. I can click on each item and change the information manually. The app uses information that I have entered on my profile as well as explicitly on the goal setting screen for this information. Other information is data that I enter that I have taken myself. I use this screen to keep track of where I am along the way to reaching my goal and to reassess it as I go along. When my weight has changed I reenter the current data and possibly readjust my weekly goal to alter the pace of my weight loss. I also change the information reflecting my activity level when my activity level has changed or I expect it to change. I have previously subscribed to premium features on this screen and used it to track more granular nutritional goals such as macronutrient intake and workouts.,"83:99,146:152,275:283,398:405,577:587,742:746,771:782,828:842,1003:1020,1029:1042,1043:1049,1054:1062"
https://play.google.com/store/apps/details?id=com.google.android.apps.fitness,Google Fit,"My goal in using the Google Fit journal screen is to keep track of my physical activities and monitor my progress over time. I use this screen to see the list of all the exercises I have done on a given day or over a certain period.

I can scroll through the list of activities to see the details, including the type of exercise, duration, and calories burned. Additionally, if the fit missed and exercises I can add them with the plus in the bottom right corner.

There are several pieces of information that Google Fit Journal page likely uses. It uses location information from the GPS along with velocity for workouts to track where and how fast I am moving for my cardio workouts. Google fit also integrates with my smartwatch which additionally has a heart rate monitor. This heart rate information is available for me to view from google fit directly.","399:408,210:231,604:612,761:779,314:330,180:206,617:625,332:340,70:89,105:113,559:579,346:354,589:592,786:796,725:735"
https://play.google.com/store/apps/details?id=com.healthifyme.basic,HealthifyMe - Calorie Counter,"In this page I can monitor my weight goals periodically. I can check my current weight with my goal weight daily. I can able to update my weight daily and also I can set how much weight I need to gain weekly and the app provide exercise and diet according to it. Also I can set the activity level of myself so that app can arrange workouts accordingly which is very helpful. By the all above information above app will set me a daily calorie budget automatically and also It will set me a nutrients budget too which is very helpful for my health. This app used my weight, daily work routine and also my water intake to set my food and workouts for next day. Which is very helpful for not getting exhaust. Also It can monitor my walking steps and also remind me to drink water each 1 hour and also remind me to walk if I am Idle for more than a hour.","30:42,80:86,170:207,228:236,241:245,282:296,434:448,489:505,603:615,626:630,635:643,728:741,770:775"
https://play.google.com/store/apps/details?id=com.discord,Discord,"To open this screen, I have to log in to the app first. Then I have to click on the icon of the person waving on the bottom navigation bar. I use the friends screen to see which of my friends are online. When they are online, there is a green light next to their name. When they are idle, there is a half moon next to their name. When they are completely offline, there is a grey button next to their names. Then I can reach out to them using a direct message or chat with them on a server that we are both a member of. I can click on their name and see which mutual servers we are currently a member of. I can also use this screen to add new friends by searching for their usernames or phone number. I can also use this screen to remove friends. The app knows my list of friends and uses that information to populate this screen.","184:191,401:406,483:489,541:545,567:574,575:600,674:683,687:699"
https://play.google.com/store/apps/details?id=com.moimob.billplanner,Monthly Bill Planner,"To use this screen I input all of my bills, their amounts and when their due date is. It helps me keep things organized and know which bills have been paid and which are coming due. You can also change the due date to the following month to knock it down to the bottom of the list, so you're not confused with what bills have or haven't been paid. There is also an option to edit the paid date but so far I have not found this feature to work like it's intended to. I am also able to change the settings to input whether it's a recurring bill and if it's a bill that will be ongoing for the future. It's also easy to delete bills, add new ones or change existing information. I like the fact that you can easily edit the amount due to keep track of ongoing expenses each month. ","37:42,50:57,62:84,160:180,206:214,310:346,384:393,495:503,513:542,547:597,721:727,749:756,757:765"
https://play.google.com/store/apps/details?id=com.paypal.android.p2pmobile,PayPal,"This is the part of the PayPal app that allows me to see what I have been spending my money on.  I use it to help me not spend so much money, it helps me know/remember where and what my money is being used for much easier than simply thinking about it alone, this allows my mind to have a better mental picture of my spending.  It also informs me about all types of payments I may have either from another paypal account or even direct deposits because PayPal now gives you the option to receive direct deposits just like a ""normal"" bank using an account and routing number, but its through paypal!  It's a good part of the part to always know where the money is coming from and where the money is going to.  There are also menus that allows you to put money into your account using cash you can deposit at a variety of stores such as gas stations, walmart, gamestop, etc.","57:94,135:140,178:209,317:325,366:374,413:420,436:444,496:511,533:537,559:573,644:674,679:706,783:787,820:826"
https://play.google.com/store/apps/details?id=com.google.android.apps.fitness,Google Fit,"Google Fit is an app designed to help people reach their fitness goals. It allows users to track their daily physical activity, such as walking, running, cycling, and swimming, as well as record their weight and calorie intake. Through the app, users can set goals for themselves, monitor their progress, and receive personalized advice and insights to help them reach their goals.  To use the app, users first need to enter their personal information and activity goals. Then they can start tracking their progress by logging their activities, calories burned, and other relevant data. Additionally, Google Fit allows users to connect with third-party apps and devices, such as Fitbit and Strava, to receive real-time updates on their progress.  Google Fit uses data collected from users’ activities, like steps taken and calories burned, to create personalized insights and advice based on their fitness level, activity goals, and physical condition. This data is then used to generate personalized fitness plans tailored to the user’s individual needs. The app also features a dynamic home screen that allows users to quickly view their progress and upcoming activities.","783:788,662:669,375:380,850:871,807:812,1001:1014,533:543,330:336,57:70,898:911,736:744,109:126,913:927,341:349,431:451"
https://play.google.com/store/apps/details?id=com.instacart.client,Instacart,"This is the place I go to when I am ready to start an order. I can apply benefits through here that I have earned in order to save some money on the order that I am about to place. I do so by selecting a voucher or a promo code offer that is ongoing. The main interactions on this screen are selecting my credit card information after choosing my items, and then the app takes that payment info and credit card that I have set up on this page at the top, applies any potential discounts that I may have added, takes my name, and uses my address. The app uses this information in order to know where to deliver it to, what to cards to charge, how much to charge each of them, and it then gives my full name and delivery address to the delivery driver for completion.","73:81,149:154,204:211,217:227,228:233,305:328,347:352,382:394,399:410,477:486,519:523,537:544,617:640,696:705,710:726"
https://play.google.com/store/apps/details?id=com.duolingo,Duolingo - Language Lessons,Getting to this screen is pretty simple you just navigate to your profile and you can see your friends and followers there. From there you can get to this account screen with the gear and i can change a lot of different things about my account. Changing everything is pretty easy you just tap it once and you can then type out your desired changes pretty simply. Along side that you can save or not save the details and you can also change accounts if lets say you had a friend that wanted to log in and learn while they were using your device. Besides that you can also change how you share info with your friends and anyone that follows you and choose just how much they can see also. The screen allows you to do a lot with very little effort and it is rather helpful and useful because of that.,"66:73,107:116,155:162,471:477,607:614"
https://play.google.com/store/apps/details?id=com.walmart.android,Walmart Shopping & Grocery,"I use this screen to look through orders and to see when they are going to arrive. It needs my name and address to be able to track these orders, naturally. It's also useful to remember which items are about to arrive and what I've ordered already. Without this screen I would have no way of looking through the different orders or to know when orders will arrive. It also allows the returns and other information about orders available. Often, Walmart will run out of an item and they will substitute another item. Often the changed item isn't very good, so in this page you can tell reject the subbed items before the delivery is made. This app is a very efficient way of looking through orders on the go and unlike many other apps, doesn't constantly having me wishing I was using the desktop version instead. This screen and by extension this app help me reach my shopping goals and needs.","34:40,95:99,104:111,186:217,222:247,472:476,603:608,868:882"
