app_url,app_name,scenario_text,infotypes
https://play.google.com/store/apps/details?id=com.apalon.to.do.list,Productive - Habit tracker,"It is a habit tracker with quite good tracking habits and monitoring my fitness activities regularly. This app manages and have streaks for variable habits which are very good for us to maintaining regular activities as well they discipline us in order to the data we have provided to them in the app. They have mentioned and promised that, they will keep my data and information which I have provided will be safe and secure. Also they mentioned that they will monitor my account on behalf of my wellness and discipline with consistency. First, I achieved the goal named ""Regular exercise"" which suggests me to do a 10 minute workout. After I followed the app's recommendation, I have uploaded my data and the tracker app immediately appreciated me and given a reward which made me happy and felt accomplished more! I've decided to do many activities which are suggested by this wonderful tracking app.","38:53,72:90,149:155,260:264,368:379,473:480,627:634,663:677,841:851"
https://play.google.com/store/apps/details?id=com.walmart.android,Walmart Shopping & Grocery,I use this screen to look up when I bought a product last so I can see how long it lasts me. I also use this screen to find exact items that I liked but cannot remember. it also helps me because you can use this screen to start a return and return items in store that you don't like. It helps me when I am shopping because it tells me when I bought the exact item before. I use this a lot when it comes to groceries and personal care products because I can look up when I bought them and get an idea on how many I need to buy a month so I can budget for it. I probably shop at Walmart more than any other store so things like purchase history and super important to me. It gives me peace of mind to know there is a record of all of my shopping at the store.,"29:57,71:91,124:168,248:253,335:370,420:442,503:533,605:610,626:642,715:743"
https://apps.apple.com/us/app/myfitnesspal-calorie-counter/id341232718,MyFitnessPal - Calorie Counter, The goals that I want to achieve through the screen shown in the screen shot that I have submitted are to track my caloric intake by tracking my food each day.  My interactions with this screen in order to achieve my goals are to input my food information for each day and also better track what it is that I am eating so that I may keep track of my caloric intake and what I am eating each and every day that I use the app.  The information that is used by this app to support this screen is the food that I eat each and every day. This information is then processed and used in order to tell me what my estimated and/ or exact caloric intake has been for the day based on the food that I input within the app's interface when I decide to input,"240:256,292:319,351:365,370:405,498:502,503:532,624:637"
https://apps.apple.com/us/app/spending-tracker/id548615579,Spending Tracker,"I use this screen several times a day to keep track of my spending and income. This is a manual app and not tied to my bank account, credit cards, phone number or email address. Every time I spend money, I open the app and then enter how much I spent and categorizes the expense. Conversely I do the same when I receive an income credit. I use this screen to keep a running tab on how much I am spending daily in order to keep me on track for my weekly and monthly savings goal. I can view my daily, weekly, monthly and yearly data at anytime to see my spending history to review. It is from those screen I analysis what spending categories, if any, I need to make adjustments on throughout the week and month in order to meet my savings goals.  Also based on my patterns of spending. I can also predict my spending and savings  better for the future weeks and months. ","465:477,147:159,197:202,71:77,553:569,323:336,234:278,381:409,163:176,630:640,119:131,58:66,133:145,730:743,527:531"
https://play.google.com/store/apps/details?id=com.healthifyme.basic,HealthifyMe - Calorie Counter,"I want gain a weight. This app shows my current weight and gaining weight, My active level It is very helpful for me. It contains a Nutrition goal my daily calorie budget like protein level, carb, fats and fiber level How many Grams I want to eat for my weight gain. It shows How many glass of water I want to drink it is very useful for me.  How many steps I want to walk It also shown In the page. I followed This activity for my goal settings.  This app is very helpful for me. It shows a all details in the page. This app gives a daily information's about my health very well. I followed all the given activity I really gain some weight. I can feel it. In this app this page is very important and useful page. I am really happy with this app. It very helpful for me.","67:73,78:90,156:170,176:189,191:195,197:201,206:211,212:217,254:265,276:318,343:372,416:424,432:445,540:569"
https://play.google.com/store/apps/details?id=com.twitter.android,Twitter,"I use the Topics screen to choose topics suggested by Twitter's algorithm with the goal of further personalizing my timeline. If I am interested in a suggested topic, I click on the plus sign to the right of it. From there, the suggested topics I chose are moved to the ""Followed"" category of the Topics page. If I am not interested in a suggested topic, I click on the gray X beside it and it is moved to the ""Not Interested"" category of the Topics page. The app uses my chosen suggested topics in other parts of Twitter, including the For You page and the Search tab. In the For You page, tweets that fall under my chosen suggested topics are shown to me as an alternative to showing me what the people I follow are posting. On the Search page, various phrases and hashtags that fall under the umbrella of my chosen suggested topics are shown to me.","10:16,348:353,591:597,689:725,755:762,767:775,828:834"
https://apps.apple.com/us/app/community-first-cu-of-florida/id768808164,Community First Credit Union of Florida,"I use this screen to stay on track with my finances. This screen shows me all my recent transactions that my checking account has been involved in. I look at this multiple days per day to make sure that my account is safe, and that no unwanted charges have been charged using my account. Cyber security is a major concern these days, and I have had charges to my account in the past that I did not authorize. Thankfully, I used this app to stay notified of these charges and was able to put a stop to it immediately, and get all the charges refunded right away. I was also able to change my checking account number and password so that it would not happen again by the same people. Another way that I use this app is to see exactly how much money I have coming in and going out every month. This allows me to make a proper budget for the year.","43:51,88:100,109:125,244:251,288:302,363:370,591:614,619:627,732:789,823:829"
https://apps.apple.com/us/app/pok%C3%A9mon-go/id1094591345/,Pokmon GO,"To get information on a specific Pokémon, I would tap the Pokeball. Then, I would navigate to Pokemon, then click on the Pokemon I am interested in. On this screen, I have many useful options. First, I can see if the Pokemon can evolve to become better so I can use it to battle. I have the option to also transfer the pokemon to gain more candy to evolve similar Pokemon.  I can also check the pokemon's stars to if the Pokemon is of high quality and worthy of keeping. I can also check Pokemon to see where I caught them as a reminder of all the places I have been. For this, the app must track my location in order to let me know what area I was in when I caught the Pokemon. On this page, I can also offer a trade to my friends, which means the app would need access to my contacts. ","33:40,319:326,340:363,405:410,503:522,540:554,555:566,600:608,670:677,724:731,777:785"
https://play.google.com/store/apps/details?id=com.twitter.android,Twitter,"I use this screen when I am wanting to catch on what a particular person has tweeted. My entire feed can become a lot and be a lot to go through. When I want to catch up with a certain person or an issue they tweet about I will go to someone's profile page. I can then look at their tweets or their tweets and replies. Sometimes I realize I haven't seen a friend for a bit so I can see if they have been active lately. I might also look at that person's likes to see if they have been active and are alright. Once in a while, I will want to refer to something I remember someone posting. On this page, I can search by terms to try to locate an old tweet for a particular person. This screen will also show other people Twitter suggests I follow based on people I am already interested in.","48:84,96:100,198:214,244:251,299:305,356:362,618:623,648:653,671:677,712:718,754:787"
https://apps.apple.com/us/app/lichess-online-chess/id968371784,lichess - Online Chess,"I like to use this page of the app, Lichess, because it is very informative and it can teach you great openings and tactics for the beginning game of Chess. I want to be able to achieve greatness by learning all the ins and outs of the tactical openings and how to predict them accordingly. You can view different types of guides from different people and/or from certified OGs who are grandmasters at this very complex game. You can even create your guides to help the community grow and to teach them your unique ways! The information used on these screens are based on a review guide and how the community reviews them. It is a good idea to read up a coupled guides before typing your own so you understand what the community wants and how it impacts your chess playing in the field of unforgiving moves where it can punish you.","103:111,116:123,150:155,216:219,236:253,323:329,345:351,420:424,574:586,591:616,719:728,739:753,759:764"
https://apps.apple.com/us/app/discord-chat-talk-hangout/id985746746,Discord,"This screen allows you to change your Username, which can be done at any time and works in tandem with servers you may be on. (Certain servers may ask that you change your username to match the theme, or for identification purposes within that community you have joined.) It allows you to change your password, or to input a phone number should you need to recover your account due to account theft or anything else that may occur that compromises your account's safety. This page also allows you to enable security measures to protect your account from unwanted access. You can also use this page to manage blocked users who you no longer want to be able to contact you, you may also disable your account here. You interact with this screen by selecting which option you need and following the prompts after to confirm or cancel changes. You can also disable your account, should the need arise, or delete it. The information that is used to support this screen is usually access to your email address, phone number or authentication device program that is on your phone that confirms that you are who you say you are. This screen is primarily for managing your safety as well as limiting or allowing people to contact you. Anything on this screen is interactable so I would typically click on Username, and it would allow me to change my username in a pop up that arises or a different screen. It may ask for confirmation to get there.","38:46,244:253,301:309,453:460,989:1002,1004:1016,1066:1071,1340:1348"
https://play.google.com/store/apps/details?id=com.grubhub.android,GrubHub,"I use this screen in order to cash out on the benefits that I have earned over the last few weeks and months, primarily the rewards through previous purchases. I can apply these rewards to a brand new order and even combine them for separate orders. In order to cash out, I simply either select an option that has been unlocked for me as a result of my purchases, or apply a cash discount in the form of a discount or a promo code. The app will then use my full name in order to show who it must be delivered to, as well as taking my address and my profile picture down the line in my order, right before I place it and I confirm it. The ultimate goal is to have the food delivered to me at a discounted rate because of the rewards that I have earned on the app itself.","46:54,149:158,178:185,201:206,242:248,375:388,406:414,420:430,457:466,484:498,534:541,549:564,667:671"
https://play.google.com/store/apps/details?id=com.gamefly.android.gamecenter,GameFly,"This is the screen that lets me track what games I have rented, and which ones I have on my lists. This screen needs payment and an address in order to function. My goal is to organize my game lists in such a way that I get the games I want at the right time, and that they do not send me less desirable games. To do this I have to order the games in the order I want them, but I also need to take into account the Availity of the games as I do this. The app uses both their in-store counts on what they have, as well as my name and address to know where to send the games. Other than that it also has my payment info as I need to be able to pay for the services that the company provides to me. Lastly, I also have the option to buy the games, so I need to pay for that as well. ","38:62,68:97,117:124,132:139,188:198,342:347,524:528,605:617"
https://apps.apple.com/us/app/spotify-music-and-podcasts/id324684580,Spotify,"This is my main hub for what I listen to the majority of the day.  I mainly listen to podcasts when I use Spotify, so I will go to my ""New Episodes"" section and select the episodes from the subscriptions I have that I want to listen to, then I download them, and wait for them to finish.  Once their downloaded I go to my ""Your Episodes"" tab and begin to listen.  As I complete episodes they are marked as completed, then I remove the download to preserve space on my phone.  Occasionally I go to the home or search tab to look for new music, but I have a large amount of songs that I have ""Liked"" that are my go-to's.  When I feel like listening to music instead of podcasts, I normally go to my Like Songs and click shuffle and see what pops up.","139:147,190:203,378:386,572:577,650:655,667:675,697:707"
https://apps.apple.com/us/app/workit-fitness/id1570096202,Workit Fitness,"I use this screen to keep track of my workout for the day. It allows me to view the sets and reps I have done for various exercises and gives me a good visual representation of my progress. I can also click on an exercise like 1. Reps 10 and it will take me to the exercise where I can then add another set if needed. Mainly I use this screen to get a better sense of what I did for the workout, what I might want to improve on for next time and how much weight I'm lifting. I also like the fact that I can go to any date on the calendar and get a breakdown of my workout for the day and in this case I have a breakdown of what I did today which better informs me about what I should be doing for my next workout. The app uses data that I manually input for each set which has how many reps and how much weight I am doing for a particular exercise to generate this log of information that I use.","38:45,84:88,93:97,122:131,180:188,446:473,517:521,777:790,795:847"
https://apps.apple.com/us/app/cronometer-calorie-counter/id1145935738,Cronometer - Calorie Counter,"I use this screen to track my meals for each day. I use it for a reference often to see how many calories I've eaten that day, how many more calories I can have for the day, and how close I am to target for my protein goals. I use it as a tool to make sure I'm not consuming too many carbs and I try to use it to keep an eye on my fat intake so I don't exceed my daily allotment. I click on the orange + often to log my foods. Sometimes I click on the Foods option to add custom recipes so I can easily track my food daily. If I swipe right at the top where it shows my macros, I can better see the micro nutrients for the day and make sure that I'm on track for everything there as well. I find it helpful to see my energy and weight on this screen.","30:35,88:125,127:172,178:223,284:289,331:341,420:425,452:457,479:486,512:516,570:576,599:614,717:723,728:734"
https://play.google.com/store/apps/details?id=com.paypal.android.p2pmobile,PayPal,"This is the PayPal Wallet screen. On this screen, I can manage most of my finances through PayPal. I can add bank accounts to my PayPal, I can apply for new cards through PayPal, I can cash checks that I receive from this screen, and I can even manage my payment plans that I've used from PayPal; for example, the Pay in 4 that PayPal offers to many retailers, I can manage from this screen. I can setup other payments such as Google Pay and Samsung pay from this screen. I can manage my automatic payments I have setup for things like subscriptions, and I can apply for credit through PayPal with one of their options that are available to me. I can also create a debit card from PayPal through this screen, which will allow me to use money on my account rather than my bank card to make purchases. Finally, I can add cash for specific stores that I frequent.","736:741,748:755,536:549,157:162,255:268,109:122,498:506,190:196,74:82,819:823,837:843,665:675,789:798,771:780,350:359"
https://play.google.com/store/apps/details?id=com.instagram.android,Instagram,"This screen helps me connect with other people who are my friends or who we have close contacts with each other. The screen helps me largely expand my social network. It helps me grow socially and relate well with my friends outside physical closeness. It helps me know my friends social life and wellness as well as associate with them socially. The screen asks me permission to collect my contacts from my phone storage so as it can show me people I know through my contacts and indicate their social life and how they relate socially. It shows how they perform socially and also enables me to realize where they have come from to reach this far. In a nutshell, it helps me know more about my friends' lives than I know through personal contacts. This hugely helps me to engage with them with prior knowledge of how their life is outside our physical interactions. ","87:95,151:165,217:224,281:292,297:305,408:421,443:449,512:536,547:572,604:638,704:709,730:747,814:828,844:865"
https://play.google.com/store/apps/details?id=com.topstep.fitcloudpro,FitCloudPro,"The goals here are to keep a low heart rate. I have a problem with my thyroid which gives me a higher than normal heart rate and this tells me about the average on each day. I check it more than daily to make sure I am not much higher than normal and usually in a 90-105bpm range so I don't need to contact my doctor. The information here is taken a few times a day and averaged to give that number shown per day. That being said, I check this daily and usually a few times a day to see what my heart rate is and if I need to do less strenuous things and relax or if I am ok to keep on working on what I am doing at that point in time. It is very helpful to have something like this tied to my watch where I can get a read out pretty much anytime I want to get my vitals looked at and not have to go to a doctor or anywhere like that. ","33:43,70:77,310:316,764:770"
https://play.google.com/store/apps/details?id=com.truebill,Rocket Money,When using the Rocket Money app I am able to keep track of all of my expenses every month which highlights the income I have coming in and the bills and expenses I have going out. It keeps tracks of my bills and lets me know what bills I have coming up that are due and what the amount is. It also gives me insight on what income I have coming into my account within the same month. I am able to achieve my goals by being able to keep better track of my bills that are due each month. It connects with my bank account through a service called Plaid so it also updates when charges appear on my bank account. I also have the option to mark a bill as paid. Overall it helps me keep better track of my spending so I am able to have a better hold on my finances. ,"111:117,118:134,153:161,225:265,270:288,318:381,594:606"
https://apps.apple.com/us/app/shop-all-your-favorite-brands/id1223471316,Shop - All your favorite brands,"I shop online daily and often and use several different apps to buy. This screen is helpful it shows all incoming orders I have in one screen instead of me having to go into each app to track different deliveries. It logs into my email address to track when I get emails for shipping notifications from all of my different apps - such as Poshmark, eBay and Mercari. If a photo is available, it will also include that on the left side of each order so I'm not confused what is in that order. I can also have it connect to my Amazon account and it can track all the orders from there. I can get notifications on status updates and estimated delivery dates. This screen will also update once the package is delivered. It can be helpful when a package is getting delayed when I would otherwise probably not know without going to the specific app. ","114:120,202:212,230:243,264:270,338:346,348:352,357:364,442:447,524:538,610:624,639:653,693:700"
https://apps.apple.com/us/app/apple-health/id1242545199,Apple Health,"It's important to me that I am not sitting for too long throughout the course of the day.  This screen tells me how many hours i was able to stand throughout the course of the day and/ or the course of the week.  The goals that I want to achive through this screen are to use the app in order to track my time spent standing over the course of the day.  I can also use it to examine trends over the course of a week and examine why certains days were better than others for me.  My interactions with this screen in order to achieve these goals, is I use it in order to gain insight and snap shots into how often I stand throughout the day and make sure that I am meeting my goals.  The information that is used by this app in order to support this screen includes biometric data such as body movement and body position.","112:168,302:351,383:389,602:638,764:778,787:800,805:818"
https://apps.apple.com/us/app/macros-calorie-counter/id1216666985,Macros - Calorie Counter,"I use this app to log my meals for the day. To log my breakfast and lunch I open up the app and go to meals. Then, I click on Add food underneath the appropriate heading like Breakfast, search for the food I want and adjust the quantities as needed. I repeat this process until I have entered everything for that meal. I then do the same thing for lunch, dinner, snacks and water consumption. The app is great because it allows me to see what I have consumed for the day and how close I am to my target caloric goal. It also has a large library of foods from various suppliers so I can usually get the correct items especially if they are prepackaged. The app also gives me a breakdown of my carbs, protein fat versus what it thinks I should be trying to hit for the day which helps me stay on track and adjust my diet as need be.","475:515,699:710,374:391,363:369,68:73,228:238,692:697,718:770,548:553,438:470,102:107,355:361,610:615,313:317,201:205"
https://play.google.com/store/apps/details?id=com.microsoft.teams,Microsoft Teams,"To set up and organize a team on teams, I navigate to the Teams tab from the Teams main menu. Next, I click the Create team button, this will start the process of creating a new team. I choose the team type; I can choose from an Existing Office 365 Group or a New team. I then enter the team name and description. Next I will need to go to privacy settings and choose from ""Private"" (only members can see the team and its content) or ""Public"" (anyone in the organization can see the team and its content). I will then Add team members. I can add members by searching for them in the Teams directory, or by entering their email addresses. Once you've entered all the required information and added team members, click the ""Create"" button to create the team. Your new team will now appear in the Teams tab and will be ready for use.","197:206,249:254,287:296,301:312,340:356,422:429,522:534,546:553,621:636"
https://play.google.com/store/apps/details?id=com.myfitnesspal.android,MyFitnessPal - Calorie Counter,"The app was amazing to use personally I felt this is save to maintain my personal detail. When I entered into the app that asked my personal detail like my age, date of birthday gender and the second thing ill give my physical detail like my height weight etc., specially of this app that's was shocked tracking the body mass index of my feature its was really amazing I never saw thus feature previously  in any other app more over that the app was easy to handle and using app without any other support but in some usage was so difficult here it make me easy. I share the detail about this app with my friends first they are shocked after, I explain the details they are aldo very happy about it. And finanly I thank to giving this opportunity for me. its was so help me to maintain my physical health. and fitness on track","132:147,156:159,161:165,178:184,218:233,242:255,316:331,604:611,788:803"
