app_url,app_name,scenario_text,infotypes
https://apps.apple.com/us/app/pregnancy-tracker-babycenter/id386022579,Pregnancy Tracker - BabyCenter ,"This feature is designed to show the progression of my children's stats - height, weight, and head size. There is an average stat for boys and girls, and this feature lets you compare your child to others of the same age. I input their starting stats, which is measured at each doctor checkup. In the background, the app shows the typical growth line so you can see where your child lines up. I can select to view all stats in one chart or weight, height, or head individually to see where my child is on the scale. Each tab at the top can be selected to view that particular stat. The app calculates the exact percentile each child falls in. Each time I go to checkups with my child, I input the new stats, and see if any of the percentile has changed. As I keep inputting numbers, the progression line begins to form and I can tell if my child is falling behind, is consistent, or irregular in their stats.","33:51,82:88,94:103,217:220,245:250,278:284,339:350,448:454,493:498,576:580,601:638,787:803"
https://play.google.com/store/apps/details?id=com.andrewshu.android.redditdonation,rif is fun golden platinum,"This is the Reddit homepage that I usually land on when I first open the app. My goal for this page is to enjoy and distract myself by scrolling the top posts for the day.  I usually scroll the titles and any thumbnail (if available) to see if there's anything that will interest me. When something does interest me, I click on it to learn more and to read people's comments about the post. I upvote comments that I like and downvote ones that I don't like. Sometimes I leave a comment of my own. The information used by the app for the screen is my username that is tied to my email. They collect information about my interactions to specific posts to gather what kinds of ads they should serve me. Like any social media page, Reddit collects user data in order to determine what ads to serve the specific users.","153:158,194:200,252:279,385:389,400:408,478:485,550:558,578:583,598:609,619:631,660:698,716:721,744:753,781:812"
https://play.google.com/store/apps/details?id=tv.twitch.android.app,Twitch,"This screens offers information about rewards and kickbacks I have earned over time by using twitch while connected to my Amazon Prime account. There are also direct look special by Amazon Prime itself as a kickback from Amazon Prime for connect it to Twitch. So you get kickbacks from both Amazon Prime itself, and Twitch, by connecting the two , while watching streamers. These kickbacks are typically directly related to the games those streamers are playing and you are obviously interested in. In game perks like premium time, free items, bonuses and boosters. You also get one free subscription to a streamer as a gift from Amazon Prime. So there is a lot of incentive to connect them and make full use of your viewing time within Twitch. Something most gamers do anyway out of curiosity and interest of the game they themselves are playing. Can also win giveaway through the streamer but I do not believe those are directly tied to Amazon.","38:45,122:142,271:280,363:372,428:433,518:530,532:542,544:551,556:564,588:600,717:729,814:818,861:869,882:890,939:945"
https://play.google.com/store/apps/details?id=com.kms.free,Kaspersky Security & VPN,"This is the screen that's generated after I update the databases and run the antivirus scan.  I use this screen to detect and determine if there is any malware on my cell phone.  My goal is to ensure that the phone isn't compromised in any way.  To do this, all I need to do is wait for the scan to complete (I have it set to run automatically when I open the app) and take notice of the screen.  There is a lot of information used by the app to support this screen.  For it to run properly, I need to approve several different permissions including allowing it to ""run on top"" of the other apps on my phone.  I choose full scan so it scans the entire phone and needs access to contacts, call history, and really the entire phone.  I don't feel entirely comfortable with all of those permissions but it's required and I think antivirus apps are a must these days.","55:64,136:176,528:539,591:595,652:657,678:686,688:700,826:835"
https://play.google.com/store/apps/details?id=com.facebook.katana,Facebook,"By using this screen edit my personal and account information. Information including full name, contact info like phone number and email ID, proof of identity, account ownership, and control settings. I can change my Facebook password and security settings like two-factor authentication, and authorized logins, get alerts about unrecognized logins, safe browsing, etc. I can set my payment preferences by using this screen. I can take a quick privacy checkup to know about my important privacy issues about security. I can set or change my preferences for the following news feed, reaction preferences like emojis and stickers, notification preferences, shortcuts preferences, language, and region, media preferences like autoplay, data saver, video quality, and themes like dark mode/light mode. I can change audience and visibility settings to control who can see my posts, stories, and profile. I can access a log of my activity and also I can access my information and download or transfer a copy of my information.","629:653,678:686,96:108,444:451,811:819,764:770,655:676,541:552,745:758,383:402,266:287,508:516,150:158,877:884,131:139"
https://apps.apple.com/us/app/apple-health/id1242545199,Apple Health,"I use this screen to keep track of what my daily activity is like.  I use it to see where I am for the day and to see if I need to get some extra activity going.  I use this screen to view my calories burned, see how active I have been, how many steps I have done so far.  I also like to use it when I go for longer walks because I like to get a certain amount of steps in for the day.  The app uses my health information like exercises and walks to show me how it equates to calories burned and such.  It also shows me where I need to improve and where I am lacking.  It helps me achieve my health goals by showing everything in one spot where I can get an overview of my activity for each day and adjust when needed.","35:65,84:106,213:235,237:270,364:369,403:421,427:436,441:446,476:484,592:604,673:681"
https://play.google.com/store/apps/details?id=com.chipotle.ordering,Chipotle,"In this screen of the app that I chose to feature it is the rewards point exchange for my favorite restaurant: Chipotle Mexican Grill. Just by eating at the restaurant I am able to accumulate points whether it is a pick up in person order or an online order via delivery. Once you gather enough points based on how much you had spent you can then come to the rewards exchange and spend the points to get free stuff to redeem such as clothes merchandise, food, drinks or gift cards. It’s a great incentive as a loyalty program that I’ve benefited from greatly. The app automatically calculates the points you earn by scanning your personal QR code in person at the register or if you place an online order it will process the points at the end of the transaction. It’s very simple navigate the app itself, but in order to get to the rewards exchange all you have to do is open the app, click the tab on the main page and select the reward you want. The reward is then added to your account and all you have to do is select it as a QR code to scan at the register in person, or add it to your online order for use.","157:167,433:452,111:119,470:480,295:301,311:333,404:424,981:988,60:82,952:958,454:458,639:646,692:704,233:238,510:517"
https://apps.apple.com/us/app/apple-health/id1242545199,Apple Health,"This is the page that shows my daily highlights of active energy on my app.  I have a goal of burning a certain number of active calories each day.  In an effort to describe the goals that I want to achieve through this screen, I would say tha tI want to track how many calories I ahve burned in the past few days, and whether I burned more active calories yesterday, than the day before.  My interactions with this screen in order to achieve my goals is to look at it and see whether or not I am meeting my goals of burning the right number of active calories each day and whether or not I am actively improving.  the information that is used by the app to support this screen includes several factors including logged work outs, biometric data such as heart rate, and how active I am.","58:64,112:118,129:137,261:313,319:387,529:560,574:612,720:724,731:745,754:764,770:785"
https://apps.apple.com/us/app/apple-health/id1242545199,Apple Health,"As a user of the Apple Health app, I have found it to be an essential tool for managing and tracking my overall health and wellness. I use it to set and monitor my daily activity goals, including steps taken, distance traveled, and calories burned. I also track my nutrition by logging my meals and water intake. Additionally, I use the app to track my sleep patterns, as well as my calorie burning numbers.

My health app summary screen provides me with an overview of my daily activity, nutrition, and sleep patterns. This allows me to quickly see how I am doing in terms of meeting my goals and making progress towards my overall health and wellness goals.

I interact with the Apple Health app several times throughout the day, checking in on my progress and making updates as necessary. This app has helped me to develop healthier habits, such as drinking more water, getting more exercise, and getting better sleep.

The information used by the Apple Health app comes from a variety of sources, including my Apple Watch, my iPhone, and third-party apps that I have connected to the app. This information is then aggregated and displayed in an easy-to-understand format, allowing me to make informed decisions about my health and wellness. Overall, I have found the Apple Health app to be an incredibly valuable tool in helping me to achieve my health and wellness goals.","232:240,104:131,299:311,481:489,870:875,289:294,890:898,209:217,754:762,383:406,635:660,491:500,1356:1375,353:367,421:432"
https://apps.apple.com/us/app/community-first-cu-of-florida/id768808164,Community First Credit Union of Florida,"To log into my  Community First Checking Account, I open the app and then put in my password. I am then taken to the main screen where all of my accounts are able to be accessed. I click on my checking account from the main screen menu and I am able to see all of my recent transactions in a list. I can see the time and date of the transaction along with the amount of money that was taken from my account, and how much money was left in the account after that transaction. In order to get more information on the transaction, I can click on details and settings and then I can find out if there are any more details that the bank was given when that transaction was made. I can also check the ID of the transactions in case there is not an identifiable name on there.","41:48,84:92,145:153,193:209,274:286,312:316,321:344,356:406,412:473,515:526,555:563,588:672,695:697,755:759"
https://play.google.com/store/apps/details?id=com.facebook.katana,Facebook,I use this screen to see what friends are doing. I can see activities in my town happening. I can get the news from around the world. I keep in touch with family and friends. I use facebook to run my business and find new customers. I run ads for products that I sell online such as t shirts and hoodies. I am always aware of what is happening in my community because people in the area will post about it. I follow all the local and major news organizations so that I can know what is going on in the world around me. I use paid ads to promote products that I sell online and in person. I post links to my very own website to gain new customers for my internet marketing business. I could not imagine living today without this app and the possibilities it opens up,"59:69,76:80,106:110,166:173,181:189,200:208,222:231,247:255,285:291,296:303,350:359,440:458,530:533"
https://play.google.com/store/apps/details?id=com.google.android.gm,Gmail,This is the page where I can control which notifications I get.  I like to use this page to control the amount of email notifications and  the sounds that my phone makes when I get new emails.  I can also use this page to figure out what to do with my attachments and where to send them.  I don't like getting too many attachments because I worry about viruses and other mal ware that is in many attachments now days.  I can also use this page to access and set up my spam folder.  This is very helpful because I receive many messages now days that are spam.  There is an abundance of spam messages and it is annoying to always be filtering through these emails and trying to navigate the categories.  I like to have the spam messages filtered and moved away quickly.   ,"43:56,104:113,114:133,143:149,158:163,185:191,319:330,353:360,468:479,526:534,553:557,585:598,689:699"
https://apps.apple.com/us/app/fitbit-health-fitness/id462638897,Fitbit,"I use this screen every day to keep track of how active I am and whether or not I am hitting my personal daily targets for the day. It also allows me to see if I need to start moving around a bit more, especially on days when I am more sedentary like on my off days on Sunday when I might not be as active but I still need to get my steps in because it will be food for me in the long run. What I want to achieve is just being more fit and healthy in general and this gives me a quick glance at where I am in the day and whether or not I a meeting my goals or not. I interact with it by looking at my stats and using that information to parse out if I am ahead or behind where I want to be from an activity level standpoint. I can also click on steps and get an average breakdown of how my day is going versus the past few days, weeks, or even my monthly average.","45:60,65:110,111:118,119:130,160:195,495:516,521:563,601:606,647:670,671:706,707:712,745:750,783:802"
https://play.google.com/store/apps/details?id=com.instagram.android,Instagram,"I use this screen to take photos that I can upload directly to Instagram. There are many different features that I can use with this page. I can either post a picture to my feed, story, or my reels. If I post a pic to my reels, it will disappear after one day. I can also use different filters on whatever picture I want to take. Instagram takes data from both my face, my location, and the photo itself. Most of the data comes from after the photo is taken. They get more data the more interactions you get with your post. You can either take a picture or a video. You can tag people who are in the post afterwards. I guess the app uses your face to collect data for their facial recognition. I assume that they sell this data to others to support companies that are trying to improve their facial recognition software.","26:32,159:166,173:177,179:184,192:197,211:214,364:368,373:381,391:396,487:499,518:522,559:564,578:584,659:663,792:810"
https://play.google.com/store/apps/details?id=com.planetfitness,Planet Fitness Workouts,"To utilize this feature on the app that I chose I navigate to the app and click the My Perks button the main page once opening the app. From here I am given the ability to choose from a list of benefits that come from having membership at this gym. It’s an added incentive to being a member and helps motivate me to continue to be one and stay healthy. The goal is to be rewarded for being a member. It is my understanding that the app will sometimes tailor the benefits to my personal account, in which some benefits are more likely to be useful to me dependent on the information I provide to the account. It’s very nice to have these perks sometimes as I am a big shopper and like discounts. The app also tracks how much usage I have with certain activities that I log and tailors the perks based on these actions. ","87:92,186:224,225:235,284:290,477:493,599:606,684:693,715:736,742:760,788:793,809:816"
https://play.google.com/store/apps/details?id=com.infoscout.receipthog,Receipt Hog,"Through this screen, my goal is to earn cash through earning coins by scanning shopping receipts. I upload and scan pictures of my receipts to earn coins from this app.  The app rewards coins to me according to the amount of the receipt scanned, the higher the receipt amount, the more coins will be earned. For example, 5 coins are rewarded to a receipt that is less than $10, and in a progressive scale, a maximum of 20 coins are rewarded for a receipt that is $100 and up. Another way to earn coins from this app is to connect my online accounts such as Amazon and Walmart when prompted to do so. I also take surveys to earn coins. What is more exciting is that I can earn bonuses by doing spins on the Hog Slots. The app also has monthly sweepstakes for the members to participate to earn extra coins. The minimum amount of coins required to redeem cash from the app is 1000 coins for $5.","40:44,79:96,116:124,131:139,229:236,261:275,533:548,612:619,676:683,799:804"
https://play.google.com/store/apps/details?id=com.spotify.music,Spotify,"I can change the audio and podcast quality on this screen and set my customized preferences to Autoplay, Change language, content restriction, streaming quality, offline download quality, and offline downloaded file location. I can also customize my hearing experience using an equalizer setting. With this feature, I can change the sounds like rock, jazz, pop, and so on. I can also turn on the private session using this screen, where I can listen to my favorite songs and podcast secretly and anonymously without saving my history and activity. This is an excellent feature of this app. Using language preference, I can choose multiple languages to listen to my favorite mesmerizing music even if I don't understand the meaning of the lyrics.  I can also choose to show the lyrics of the songs I listen. This is also an excellent feature. Here, I can listen and sing together. I love this feature.","143:160,526:533,738:744,211:224,686:691,538:546,80:91,27:42,122:141,170:186,112:120,404:411,639:648,307:314,250:268"
https://play.google.com/store/apps/details?id=com.usatoday.android.news,USA Today,"I use this page to see what the top stories are around the country and world. I generally stick to this screen and expect it to provide me with the most up to date and important events that are currently happening. I generally scroll through the first few pages of news stories to see what important things are happening. There are paid subscriber stories that pop up, and I am not a paid subscriber. Although some of them look interesting, I am not going to pay for free news I can obtain from any other websites. My goals are generally to keep up to date on important topics and news. I want to be aware of what is happening around the world. The information the app collects from me to support this screen is generally the information it takes to give me targeted advertising, I suppose. However it does collect location data that can help with weather information and stories localized to the area I am in. ","337:347,767:778,815:828,848:867,880:903"
https://play.google.com/store/apps/details?id=com.google.android.apps.maps,Google Maps,"I use it to find out anything cool happening in my area. It can be a local event, a business promotion, or just interesting locations I may be interested in. I use the feature when I'm bored of being in my house and want something interesting to do. If I see something interesting I'll click on it and sometimes I'll even follow the person or business. I can use it to find directions to a location or even make a call. I also enjoy looking at pictures and videos. People are always uploading cool images from these locations. I can also save them in my contacts if I want to contact them later. It mostly uses my location information. It also makes use of my contact information. Since it's linked to my Google account it may make use of my search history or general interests. I can't be totally sure of that though.","760:777,84:102,51:55,75:80,498:504,168:175,457:463,516:525,660:679,374:384,614:634,742:756,705:719,343:351,333:339"
https://apps.apple.com/us/app/fitness/id1208224953,Apple Fitness,"I use this screen to help motivate myself and keep track of my progress.  I look at my trends at the end of each week to see where I am in terms of daily movement, and how far I need to go in order to actually meet my goals.  The goals portrayed on this screen are my movement and activity goals, in other words, how much I want to move each day in order to meet my goals.  I interact with it almost daily, but use it at the end of each week in a meaningful way.  My information such as movement, workouts, activity, and other relevant biometric data such as heart rate is used by the app in order to be able to support the screen that is depicted within the screen shot that I have submitted hwile completing this survey.  I make good use out of this.  ","63:71,87:93,125:162,168:200,210:223,281:295,313:371,487:495,497:505,507:515,536:550,559:569"
https://play.google.com/store/apps/details?id=com.android.chrome,Google Chrome,"I use Chrome on my Android phone, primarily, to download apps and other files I may need to use when working on it.  I mostly use my cell phone for work and so that is what's most crucial for me.  I say that because I often need to test apps and software as part of my job entails user testing.  Due to this, I find myself opening and utilizing the downloads screen when using Chrome quite often.  In this way, I can revisit and access recent downloads so they can be managed.  I can open and install them as well as delete apps I no longer need.  I can also ensure that there are no extraneous downloads in the folder for security purposes.  In addition to simply viewing the screen, I can also open/install apps by clicking them.  The information used by the app to support this screen would be my App activity.","27:32,72:77,133:143,246:254,281:285,595:604,709:713,800:812"
https://play.google.com/store/apps/details?id=com.squareup.cash,Cash App,"This screen is where you track the transactions you have made on Cashapp, the whole history. This screen also includes notifications and other such things, but it's the one I use to check my transaction history. It allows you to ensure a transaction has been completed. You can also access receipts for them. Each one contains the information of the person you transacted with if you tap on an individual entry, including their cashapp profile, cashtag, and other such personal info. You can check the source of the payment as well, like the bank. If the money is sitting in cashapp, you can also make it deposit it to your bank from here. It also tracks people you have transacted with in a side scrolling list up top, and has a button for recruiting people. Finally, it contains customer support options. If you want to contest a transaction, you open it up, hit the three buttons up top, and you can hit cash app support from there. Same thing if there was a problem with a transaction or it did not go through.","35:47,84:91,191:210,290:298,428:443,445:452,502:508,516:523,542:546,555:560,662:686,832:843"
https://play.google.com/store/apps/details?id=com.venmo,Venmo,I use this page to check on the status of my money and who I have paid.  From here I can navigate to my home page where I can see my payments and who has paid me.  I can see which banks and cards I have on file and which ones I want to use to pay people.  I can change or delete my bank account information here.  I can access my crypto payments here if I want to.  I use this page to manage what I want to do.  Sometimes I will delete credit card or bank account information that I do not want other people seeing.  I can control who I have as a friend here and I can either delete or add friends on to my account from this page.  I like to keep track of people here for payment purpose.  ,"32:38,45:50,55:70,133:141,146:161,174:210,215:253,330:345,436:447,451:475,531:553,590:597,607:614,656:662"
https://play.google.com/store/apps/details?id=com.socialnmobile.dictapps.notepad.color.note,ColorNote Notepad Notes,"This is basicly one of the few screens the app even has, i wanted a very basic app to use as a note book of sorts where i can manage my budget and write down important information. This screen is what i use to cycle through different color notes depending on what i am writing down to remember. important is things like medical instructions, reminders to pick up medications, peoples phone numbers or doctors appointments or just general things to remember that are of priority to me. Bills is where i manage my monthly finances and you can see that in the background. Amazon stuff is where i put monthly supplies i i need to buy from Amazon things like hand sanitizer trash bags. It doesn't always have to be from Amazon i could buy them from other areas but i just do most my shopping from Amazon so i it's named that for the moment. It's basicly my grocery and needed item list. I can sort them buy priority for instance sort by date will mean they are sorted by last input so if something is important and i just added it important in red will at the top like it is now. There is also different brackets like Notes, Colander and its current setting ALL i don't use these since they seem to all do the same thing and i just leave it on ALL. The color can be changed and change the color to things that are the most important. I wanted a simple system and i choose one.","95:104,136:142,320:340,342:351,363:374,384:397,401:421,520:528,605:613,654:679,852:859,871:880,902:910,932:936"
